{
  "contract_name": "LivingWaterAI.C8C9.Work9.UnifiedDeploymentInput",
  "contract_version": "C8C9-W9-UDI-v1.0.0",
  "baseline_id": "C8C9-BL-20260926T1014+0800-W1-5a1038869805a25e",
  "run_id": "w8-run-001",
  "work4_v82_integration_result": {
    "contract_name": "LivingWaterAI.C8C9.Work4.V82IntegrationResult",
    "contract_version": "C8C9-W4-V82AO-v1.0.0",
    "baseline_id": "C8C9-BL-20260926T1014+0800-W1-5a1038869805a25e",
    "run_id": "w8-run-001",
    "owner": {
      "funding_domain": "US_BROKER",
      "broker": "QA_BROKER",
      "account": "QA_ACCOUNT"
    },
    "currency": "USD",
    "asset_id": "TSM.US",
    "work3_context_handoff_id": "C8C9-W3-HANDOFF-W8-001",
    "upstream_v70_snapshot_id": "v70-w8-snap-001",
    "shared_context_id": "shared-w8-001",
    "shared_context_digest_sha256": "1111111111111111111111111111111111111111111111111111111111111111",
    "authorization_reference": "C-W6-FINAL-97c157148ba5cccf73dfe332",
    "consumed_equity_executable_budget": {
      "amount": "450.00",
      "currency": "USD",
      "cash_basis": "AVAILABLE",
      "owner": {
        "funding_domain": "US_BROKER",
        "broker": "QA_BROKER",
        "account": "QA_ACCOUNT"
      },
      "source_pointer": "/funding_context/executable_budget/equity"
    },
    "canonical_v82_output": {
      "contract_name": "LivingWaterAI.V82.RuntimeOutput",
      "contract_version": "V82-OUTPUT-v1.0.1-W2-RECHECK2",
      "run_id": "w8-run-001",
      "v82_snapshot_id": "v82-w8-snap-001",
      "upstream_v70_snapshot_id": "v70-w8-snap-001",
      "asset_id": "TSM.US",
      "rule_version": "V82-v1.21.0",
      "data_as_of": {
        "shared": "2026-09-28T01:20:00+08:00"
      },
      "evaluated_at": "2026-09-28T01:29:00+08:00",
      "source_lineage": [
        "work3-w8",
        "c7-w8",
        "v70-w8"
      ],
      "output_status": "OK",
      "canonical_analysis": {
        "latest_price": {
          "field_name": "latest_price",
          "value": {
            "amount": 200.0,
            "currency": "USD",
            "source_reference": "market-ref",
            "as_of": "2026-09-28T01:20:00+08:00",
            "status": "KNOWN"
          },
          "data_type": "MoneyPerUnit",
          "data_as_of": null,
          "source_reference": null,
          "data_quality": "OK",
          "issue_codes": [],
          "rule_version": "V82-v1.21.0",
          "run_id": "w8-run-001"
        },
        "market_data_as_of": {
          "field_name": "market_data_as_of",
          "value": "2026-09-28T01:20:00+08:00",
          "data_type": "DateTime",
          "data_as_of": null,
          "source_reference": null,
          "data_quality": "OK",
          "issue_codes": [],
          "rule_version": "V82-v1.21.0",
          "run_id": "w8-run-001"
        },
        "asset_behavior_classification": {
          "field_name": "asset_behavior_classification",
          "value": "INDIVIDUAL_COMPANY_STOCK",
          "data_type": "EnumRef",
          "data_as_of": null,
          "source_reference": null,
          "data_quality": "OK",
          "issue_codes": [],
          "rule_version": "V82-v1.21.0",
          "run_id": "w8-run-001"
        },
        "primary_framework": {
          "field_name": "primary_framework",
          "value": "V82",
          "data_type": "RuleRef",
          "data_as_of": null,
          "source_reference": null,
          "data_quality": "OK",
          "issue_codes": [],
          "rule_version": "V82-v1.21.0",
          "run_id": "w8-run-001"
        },
        "secondary_framework": {
          "field_name": "secondary_framework",
          "value": "NONE",
          "data_type": "RuleRef/List",
          "data_as_of": null,
          "source_reference": null,
          "data_quality": "OK",
          "issue_codes": [],
          "rule_version": "V82-v1.21.0",
          "run_id": "w8-run-001"
        },
        "fundamental_state": {
          "field_name": "fundamental_state",
          "value": {
            "state": "RISK_REVIEW",
            "source_owned": true
          },
          "data_type": "StructuredState",
          "data_as_of": null,
          "source_reference": null,
          "data_quality": "OK",
          "issue_codes": [],
          "rule_version": "V82-v1.21.0",
          "run_id": "w8-run-001"
        },
        "valuation_state": {
          "field_name": "valuation_state",
          "value": "EXPENSIVE",
          "data_type": "StructuredState",
          "data_as_of": null,
          "source_reference": null,
          "data_quality": "OK",
          "issue_codes": [],
          "rule_version": "V82-v1.21.0",
          "run_id": "w8-run-001"
        },
        "td9_high_state": {
          "field_name": "td9_high_state",
          "value": "HIGH_9",
          "data_type": "SignalState",
          "data_as_of": null,
          "source_reference": null,
          "data_quality": "OK",
          "issue_codes": [],
          "rule_version": "V82-v1.21.0",
          "run_id": "w8-run-001"
        },
        "td9_low_state": {
          "field_name": "td9_low_state",
          "value": "NONE",
          "data_type": "SignalState",
          "data_as_of": null,
          "source_reference": null,
          "data_quality": "OK",
          "issue_codes": [],
          "rule_version": "V82-v1.21.0",
          "run_id": "w8-run-001"
        },
        "kd_state": {
          "field_name": "kd_state",
          "value": "WEAKENING",
          "data_type": "SignalState",
          "data_as_of": null,
          "source_reference": null,
          "data_quality": "OK",
          "issue_codes": [],
          "rule_version": "V82-v1.21.0",
          "run_id": "w8-run-001"
        },
        "macd_state": {
          "field_name": "macd_state",
          "value": "WEAKENING",
          "data_type": "SignalState",
          "data_as_of": null,
          "source_reference": null,
          "data_quality": "OK",
          "issue_codes": [],
          "rule_version": "V82-v1.21.0",
          "run_id": "w8-run-001"
        },
        "ma_state": {
          "field_name": "ma_state",
          "value": "BELOW_MA20",
          "data_type": "StructuredSignal",
          "data_as_of": null,
          "source_reference": null,
          "data_quality": "OK",
          "issue_codes": [],
          "rule_version": "V82-v1.21.0",
          "run_id": "w8-run-001"
        },
        "emv_state": {
          "field_name": "emv_state",
          "value": "WEAK",
          "data_type": "SignalState",
          "data_as_of": null,
          "source_reference": null,
          "data_quality": "OK",
          "issue_codes": [],
          "rule_version": "V82-v1.21.0",
          "run_id": "w8-run-001"
        },
        "rsi_state": {
          "field_name": "rsi_state",
          "value": "NEUTRAL",
          "data_type": "SignalState",
          "data_as_of": null,
          "source_reference": null,
          "data_quality": "OK",
          "issue_codes": [],
          "rule_version": "V82-v1.21.0",
          "run_id": "w8-run-001"
        },
        "volume_price_state": {
          "field_name": "volume_price_state",
          "value": "SELL_PRESSURE",
          "data_type": "StructuredSignal",
          "data_as_of": null,
          "source_reference": null,
          "data_quality": "OK",
          "issue_codes": [],
          "rule_version": "V82-v1.21.0",
          "run_id": "w8-run-001"
        },
        "daily_timeframe_state": {
          "field_name": "daily_timeframe_state",
          "value": "WEAK",
          "data_type": "TimeframeState",
          "data_as_of": null,
          "source_reference": null,
          "data_quality": "OK",
          "issue_codes": [],
          "rule_version": "V82-v1.21.0",
          "run_id": "w8-run-001"
        },
        "weekly_timeframe_state": {
          "field_name": "weekly_timeframe_state",
          "value": "NEUTRAL",
          "data_type": "TimeframeState",
          "data_as_of": null,
          "source_reference": null,
          "data_quality": "OK",
          "issue_codes": [],
          "rule_version": "V82-v1.21.0",
          "run_id": "w8-run-001"
        },
        "monthly_timeframe_state": {
          "field_name": "monthly_timeframe_state",
          "value": "UPTREND",
          "data_type": "TimeframeState",
          "data_as_of": null,
          "source_reference": null,
          "data_quality": "OK",
          "issue_codes": [],
          "rule_version": "V82-v1.21.0",
          "run_id": "w8-run-001"
        },
        "atr_value": {
          "field_name": "atr_value",
          "value": 8.0,
          "data_type": "Decimal",
          "data_as_of": null,
          "source_reference": null,
          "data_quality": "OK",
          "issue_codes": [],
          "rule_version": "V82-v1.21.0",
          "run_id": "w8-run-001"
        },
        "drawdown_from_reference_high": {
          "field_name": "drawdown_from_reference_high",
          "value": 0.12,
          "data_type": "Rate",
          "data_as_of": null,
          "source_reference": null,
          "data_quality": "OK",
          "issue_codes": [],
          "rule_version": "V82-v1.21.0",
          "run_id": "w8-run-001"
        },
        "previous_swing_low_1": {
          "field_name": "previous_swing_low_1",
          "value": {
            "amount": 180.0,
            "currency": "USD",
            "source_reference": "market-ref",
            "as_of": "2026-09-28T01:20:00+08:00",
            "status": "KNOWN"
          },
          "data_type": "MoneyPerUnit",
          "data_as_of": null,
          "source_reference": null,
          "data_quality": "OK",
          "issue_codes": [],
          "rule_version": "V82-v1.21.0",
          "run_id": "w8-run-001"
        },
        "previous_swing_low_2": {
          "field_name": "previous_swing_low_2",
          "value": {
            "amount": 170.0,
            "currency": "USD",